[
  {
    "id": "runtime:claude:PreToolUse",
    "title": "Claude Code - PreToolUse",
    "purpose": "Проверяет вызов инструмента до его исполнения в агентном runtime.",
    "protects": "Рабочее дерево, секреты, Git, данные и инфраструктуру от опасных действий агента.",
    "kind": "runtime-hook",
    "source": ".claude/settings.json",
    "marker": ".guardrails/src/cli.ts",
    "bundles": [
      "baseline"
    ],
    "expectedFailureMode": "closed",
    "notes": "Нативный PreToolUse."
  },
  {
    "id": "runtime:claude:UserPromptSubmit",
    "title": "Claude Code - UserPromptSubmit",
    "purpose": "Скан промпта на инъекции, маркеры конфиденциальности и многоходовые PII-зонды.",
    "protects": "Контекст модели от инъекций; персональные данные от сбора через диалог.",
    "kind": "runtime-hook",
    "source": ".claude/settings.json",
    "marker": ".guardrails/src/cli.ts",
    "bundles": [
      "prompt"
    ],
    "expectedFailureMode": "open",
    "notes": "Инъекции и PII-зонды в промпте; fail-open."
  },
  {
    "id": "runtime:claude:PostToolUse",
    "title": "Claude Code - PostToolUse",
    "purpose": "Скан вывода инструмента после исполнения до передачи в модель.",
    "protects": "Контекст модели от непрямых инъекций; transcript от секретов и персональных данных.",
    "kind": "runtime-hook",
    "source": ".claude/settings.json",
    "marker": "posttooluse.ts",
    "bundles": [
      "tool-output"
    ],
    "expectedFailureMode": "closed",
    "notes": "Инъекция - exit 2 с указанием модели; сбой скана не блокирует."
  },
  {
    "id": "runtime:codex:PreToolUse",
    "title": "Codex - PreToolUse",
    "purpose": "Проверяет вызов инструмента до его исполнения в агентном runtime.",
    "protects": "Рабочее дерево, секреты, Git, данные и инфраструктуру от опасных действий агента.",
    "kind": "runtime-hook",
    "source": ".codex/hooks.json",
    "marker": ".guardrails/src/cli.ts",
    "bundles": [
      "baseline"
    ],
    "expectedFailureMode": "closed",
    "notes": "Активен после доверия каталогу .codex/."
  },
  {
    "id": "runtime:zcode:PreToolUse",
    "title": "ZCode - PreToolUse",
    "purpose": "Проверяет вызов инструмента до его исполнения в агентном runtime.",
    "protects": "Рабочее дерево, секреты, Git, данные и инфраструктуру от опасных действий агента.",
    "kind": "runtime-hook",
    "source": ".zcode/config.json",
    "marker": ".guardrails/src/cli.ts",
    "bundles": [
      "baseline"
    ],
    "expectedFailureMode": "closed",
    "notes": "Нативный PreToolUse."
  },
  {
    "id": "runtime:zcode:UserPromptSubmit",
    "title": "ZCode - UserPromptSubmit",
    "purpose": "Скан промпта на инъекции, маркеры конфиденциальности и многоходовые PII-зонды.",
    "protects": "Контекст модели от инъекций; персональные данные от сбора через диалог.",
    "kind": "runtime-hook",
    "source": ".zcode/config.json",
    "marker": ".guardrails/src/cli.ts",
    "bundles": [
      "prompt"
    ],
    "expectedFailureMode": "open",
    "notes": "Инъекции и PII-зонды в промпте; fail-open."
  },
  {
    "id": "runtime:zcode:PostToolUse",
    "title": "ZCode - PostToolUse",
    "purpose": "Скан вывода инструмента после исполнения до передачи в модель.",
    "protects": "Контекст модели от непрямых инъекций; transcript от секретов и персональных данных.",
    "kind": "runtime-hook",
    "source": ".zcode/config.json",
    "marker": "posttooluse.ts",
    "bundles": [
      "tool-output"
    ],
    "expectedFailureMode": "closed",
    "notes": "Инъекция - exit 2 с указанием модели; сбой скана не блокирует."
  },
  {
    "id": "runtime:cursor:preToolUse",
    "title": "Cursor - preToolUse",
    "purpose": "Проверяет вызов инструмента до его исполнения в агентном runtime.",
    "protects": "Рабочее дерево, секреты, Git, данные и инфраструктуру от опасных действий агента.",
    "kind": "runtime-hook",
    "source": ".cursor/hooks.json",
    "marker": ".guardrails/src/cli.ts",
    "bundles": [
      "baseline"
    ],
    "expectedFailureMode": "closed",
    "notes": "Guardrails-хук работает в режиме fail-closed."
  },
  {
    "id": "runtime:kimi:PreToolUse",
    "title": "Kimi Code - PreToolUse",
    "purpose": "Проверяет вызов инструмента до его исполнения в агентном runtime.",
    "protects": "Рабочее дерево, секреты, Git, данные и инфраструктуру от опасных действий агента.",
    "kind": "runtime-hook",
    "source": ".kimi/config.toml",
    "marker": ".guardrails/src/cli.ts",
    "bundles": [
      "baseline"
    ],
    "expectedFailureMode": "closed",
    "notes": "Отсутствие bun - блок (exit 2); отсутствие guard в проекте - пропуск. Требуется зеркало в пользовательском config.toml."
  },
  {
    "id": "runtime:opencode:tool.execute.before",
    "title": "OpenCode - tool.execute.before",
    "purpose": "Проверяет вызов инструмента до его исполнения в агентном runtime.",
    "protects": "Рабочее дерево, секреты, Git, данные и инфраструктуру от опасных действий агента.",
    "kind": "runtime-hook",
    "source": ".opencode/plugins/agentos-guard.ts",
    "marker": ".guardrails/src/cli.ts",
    "bundles": [
      "baseline"
    ],
    "expectedFailureMode": "closed",
    "notes": "Плагин Bun блокирует вызов при любом сбое Guardrails."
  },
  {
    "id": "runtime:opencode:tool.execute.after",
    "title": "OpenCode - tool.execute.after",
    "purpose": "Скан вывода инструмента после исполнения до передачи в модель.",
    "protects": "Контекст модели от непрямых инъекций; transcript от секретов и персональных данных.",
    "kind": "runtime-hook",
    "source": ".opencode/plugins/agentos-guard.ts",
    "marker": "posttooluse.ts",
    "bundles": [
      "tool-output"
    ],
    "expectedFailureMode": "open",
    "notes": "Блокировка после исполнения невозможна: находки уходят в журнал и лог плагина."
  },
  {
    "id": "runtime:antigravity:PreToolUse",
    "title": "Antigravity - PreToolUse",
    "purpose": "Проверяет вызов инструмента до его исполнения в агентном runtime.",
    "protects": "Рабочее дерево, секреты, Git, данные и инфраструктуру от опасных действий агента.",
    "kind": "runtime-hook",
    "source": ".agents/hooks.json",
    "marker": ".guardrails/src/antigravity-hook.ts",
    "bundles": [
      "baseline"
    ],
    "expectedFailureMode": "open",
    "notes": "Контракт Antigravity: вход - stdin JSON (toolCall), вердикт - stdout JSON decision; обёртка antigravity-hook.ts переводит exit-коды guard. Отсутствие bun или guard - пропуск (fail-open)."
  },
  {
    "id": "code:console:run-command",
    "title": "Консоль — команды встроенного агента",
    "purpose": "Проверяет shell-команды, которые встроенный агент запускает через run_command.",
    "protects": "Рабочую папку и системные ресурсы от опасных команд из диалога.",
    "kind": "code",
    "source": "apps/console/src/core/agentTools.ts",
    "marker": ".guardrails/src/cli.ts",
    "bundles": [
      "baseline"
    ],
    "expectedFailureMode": "closed",
    "notes": "Сбой проверки запрещает команду."
  },
  {
    "id": "code:console:lifecycle-hook",
    "title": "Консоль — хуки жизненного цикла",
    "purpose": "Проверяет команды установки, удаления, включения и выключения навыков, MCP, плагинов и инструментов.",
    "protects": "Проект и компьютер от опасной команды в стороннем манифесте.",
    "kind": "code",
    "source": "apps/console/src/core/lifecycleHooks.ts",
    "marker": ".guardrails/src/cli.ts",
    "bundles": [
      "baseline"
    ],
    "expectedFailureMode": "closed",
    "notes": "Install/remove/enable/disable hooks."
  },
  {
    "id": "code:console:model-wrapper",
    "title": "Консоль — guard на вызовах моделей",
    "purpose": "Обёртка chatModelForProvider: блокирует инъекции инструкций в промпте и редактирует персональные данные и секреты в промпте и ответе модели.",
    "protects": "Персональные данные, секреты и коммерческие маркеры от утечки в LLM-провайдеров; контекст диалога от инъекций.",
    "kind": "code",
    "source": "apps/console/src/core/langchain/chatModel.ts",
    "marker": "withLlmGuard",
    "bundles": [
      "llm-io"
    ],
    "expectedFailureMode": "closed",
    "notes": "Единая точка сборки LangChain-моделей; обёртка сохраняет интерфейс модели, включая bindTools."
  },
  {
    "id": "git:husky:pre-commit",
    "title": "Git — проверка перед commit",
    "purpose": "Проверяет целостность каталога и подключений до создания commit.",
    "protects": "Репозиторий от commit с рассинхронизированными правилами или документацией.",
    "kind": "git-hook",
    "source": ".husky/pre-commit",
    "marker": ".guardrails/src/cli.ts check --quick",
    "bundles": [
      "baseline"
    ],
    "expectedFailureMode": "closed",
    "notes": "Быстрая локальная проверка."
  },
  {
    "id": "git:husky:content-scan",
    "title": "Git - скан содержимого перед commit",
    "purpose": "Сканирует добавленные строки staged diff на секреты и персональные данные.",
    "protects": "Репозиторий от commit с ключами, токенами и персональными данными.",
    "kind": "git-hook",
    "source": ".husky/pre-commit",
    "marker": "scan-diff",
    "bundles": [
      "baseline"
    ],
    "expectedFailureMode": "closed",
    "notes": "Секреты блокируют commit, персональные данные дают предупреждение."
  },
  {
    "id": "git:husky:pre-push",
    "title": "Git — проверка перед push",
    "purpose": "Выполняет полный policy check и тесты перед отправкой изменений пользователем.",
    "protects": "Удалённый репозиторий от непроверенной политики.",
    "kind": "git-hook",
    "source": ".husky/pre-push",
    "marker": ".guardrails/src/cli.ts check",
    "bundles": [
      "baseline"
    ],
    "expectedFailureMode": "closed",
    "notes": "Агенту push запрещён; хук предназначен для пользователя."
  },
  {
    "id": "verification:fast",
    "title": "Общая быстрая верификация",
    "purpose": "Включает Guardrails в обязательную проверку после изменений.",
    "protects": "От незамеченной поломки правил при обычной разработке.",